{
  "batches": [
    {
      "batch_id": "20260904000000",
      "errors": [],
      "first_raw_sha256": "96bd98bec450ed7f8208e962bb4964c600a05fc90562552729369d6efc09d9ea",
      "first_semantic_sha256": "cfb92e2a8ce48e964c18aff1af94bac5d9ba4ced47d326cd091ec1328abafff5",
      "hash_matches_acquisition": true,
      "matches_original_semantics": true,
      "second_raw_sha256": "96bd98bec450ed7f8208e962bb4964c600a05fc90562552729369d6efc09d9ea",
      "second_semantic_sha256": "cfb92e2a8ce48e964c18aff1af94bac5d9ba4ced47d326cd091ec1328abafff5",
      "semantic_equal": true,
      "status": "passed"
    },
    {
      "batch_id": "20260904001500",
      "errors": [],
      "first_raw_sha256": "9af140aecec36608d289684152d74878af6d081e49bddf9447996e7300643a6f",
      "first_semantic_sha256": "8c1ab0f98578427d81aa5db7438bc851edd991d06cd478287ba9b396aabaa284",
      "hash_matches_acquisition": true,
      "matches_original_semantics": true,
      "second_raw_sha256": "9af140aecec36608d289684152d74878af6d081e49bddf9447996e7300643a6f",
      "second_semantic_sha256": "8c1ab0f98578427d81aa5db7438bc851edd991d06cd478287ba9b396aabaa284",
      "semantic_equal": true,
      "status": "passed"
    },
    {
      "batch_id": "20260904003000",
      "errors": [],
      "first_raw_sha256": "04c33187b3f90c1ed4d86c910f967b5bd06c1803e3fbde4848d127113a8eec9e",
      "first_semantic_sha256": "e764323aa6e2e2fcf46b7150b5d7789c662640228c092135907a0044560796d1",
      "hash_matches_acquisition": true,
      "matches_original_semantics": true,
      "second_raw_sha256": "04c33187b3f90c1ed4d86c910f967b5bd06c1803e3fbde4848d127113a8eec9e",
      "second_semantic_sha256": "e764323aa6e2e2fcf46b7150b5d7789c662640228c092135907a0044560796d1",
      "semantic_equal": true,
      "status": "passed"
    },
    {
      "batch_id": "20260904004500",
      "errors": [],
      "first_raw_sha256": "e84387088b8a4f3fc27f997a548f187e2663142d79657cb1153666a3007e6583",
      "first_semantic_sha256": "83a73e56350e69daadc4b5080525b81634c0c40a8792104bd12ad74fa22390e4",
      "hash_matches_acquisition": true,
      "matches_original_semantics": true,
      "second_raw_sha256": "e84387088b8a4f3fc27f997a548f187e2663142d79657cb1153666a3007e6583",
      "second_semantic_sha256": "83a73e56350e69daadc4b5080525b81634c0c40a8792104bd12ad74fa22390e4",
      "semantic_equal": true,
      "status": "passed"
    },
    {
      "batch_id": "20260904010000",
      "errors": [],
      "first_raw_sha256": "57faf969dc89a0647a7338c8f13ded6f860523d91f2bc7bb4e7f11e521f8c7ab",
      "first_semantic_sha256": "5d63874d2e290139eaccb5d2119750688eef7b828a1d8b9acad4d33fa24ad2d8",
      "hash_matches_acquisition": true,
      "matches_original_semantics": true,
      "second_raw_sha256": "57faf969dc89a0647a7338c8f13ded6f860523d91f2bc7bb4e7f11e521f8c7ab",
      "second_semantic_sha256": "5d63874d2e290139eaccb5d2119750688eef7b828a1d8b9acad4d33fa24ad2d8",
      "semantic_equal": true,
      "status": "passed"
    },
    {
      "batch_id": "20260904011500",
      "errors": [],
      "first_raw_sha256": "b05cdeec5569986a9a64f8ff5e52c6d4bab1da19fa7fee4658f6ff456ee65cad",
      "first_semantic_sha256": "675d1cf7dbd3df083d789e74f38dce8ce7b2bf2aea060a75425e2e05441353e3",
      "hash_matches_acquisition": true,
      "matches_original_semantics": true,
      "second_raw_sha256": "b05cdeec5569986a9a64f8ff5e52c6d4bab1da19fa7fee4658f6ff456ee65cad",
      "second_semantic_sha256": "675d1cf7dbd3df083d789e74f38dce8ce7b2bf2aea060a75425e2e05441353e3",
      "semantic_equal": true,
      "status": "passed"
    },
    {
      "batch_id": "20260904013000",
      "errors": [],
      "first_raw_sha256": "105cf44b42ca242d0778f187275117b74c8122d0e01019c8091c4873d07584e0",
      "first_semantic_sha256": "0f24cca5790e3576253b0c9920c2cea66df963edce0b4cbcfe5cc1ff70978f44",
      "hash_matches_acquisition": true,
      "matches_original_semantics": true,
      "second_raw_sha256": "105cf44b42ca242d0778f187275117b74c8122d0e01019c8091c4873d07584e0",
      "second_semantic_sha256": "0f24cca5790e3576253b0c9920c2cea66df963edce0b4cbcfe5cc1ff70978f44",
      "semantic_equal": true,
      "status": "passed"
    },
    {
      "batch_id": "20260904014500",
      "errors": [],
      "first_raw_sha256": "7d21148d7af4843be2c4c138f2f7608170b41a6de40acfc62058113f0fb8a87e",
      "first_semantic_sha256": "663e69aba3cb5fc0a73bacf4a2afef933ce1b231df39f5e050b178ad8598b4d5",
      "hash_matches_acquisition": true,
      "matches_original_semantics": true,
      "second_raw_sha256": "7d21148d7af4843be2c4c138f2f7608170b41a6de40acfc62058113f0fb8a87e",
      "second_semantic_sha256": "663e69aba3cb5fc0a73bacf4a2afef933ce1b231df39f5e050b178ad8598b4d5",
      "semantic_equal": true,
      "status": "passed"
    },
    {
      "batch_id": "20260904020000",
      "errors": [],
      "first_raw_sha256": "4ca593252b42c4cfa44938f98a2a227ce591e9cf2b31528e68b616b80f786c57",
      "first_semantic_sha256": "e1324893b5aabb14a13a2a9f71b46be97eb93746d859d767cbb64fdd2bfe43ca",
      "hash_matches_acquisition": true,
      "matches_original_semantics": true,
      "second_raw_sha256": "4ca593252b42c4cfa44938f98a2a227ce591e9cf2b31528e68b616b80f786c57",
      "second_semantic_sha256": "e1324893b5aabb14a13a2a9f71b46be97eb93746d859d767cbb64fdd2bfe43ca",
      "semantic_equal": true,
      "status": "passed"
    },
    {
      "batch_id": "20260904021500",
      "errors": [],
      "first_raw_sha256": "85a2ff8eb174bdcb2ccf99fc20da260c179475bfef37ba9f654120549b04fc76",
      "first_semantic_sha256": "12f0986f5c8644598253b43f6a8866a221014a63cc45eb15316d8689cc05354e",
      "hash_matches_acquisition": true,
      "matches_original_semantics": true,
      "second_raw_sha256": "85a2ff8eb174bdcb2ccf99fc20da260c179475bfef37ba9f654120549b04fc76",
      "second_semantic_sha256": "12f0986f5c8644598253b43f6a8866a221014a63cc45eb15316d8689cc05354e",
      "semantic_equal": true,
      "status": "passed"
    },
    {
      "batch_id": "20260904023000",
      "errors": [],
      "first_raw_sha256": "72a5684513ca46a19d33c08e37bbd7a060de88cbcd2cdbae77b412377fc4514a",
      "first_semantic_sha256": "6e6f3f5171e66cae7fe939fbc6b77f815a1294e38c9029cac51fcf944a222a02",
      "hash_matches_acquisition": true,
      "matches_original_semantics": true,
      "second_raw_sha256": "72a5684513ca46a19d33c08e37bbd7a060de88cbcd2cdbae77b412377fc4514a",
      "second_semantic_sha256": "6e6f3f5171e66cae7fe939fbc6b77f815a1294e38c9029cac51fcf944a222a02",
      "semantic_equal": true,
      "status": "passed"
    },
    {
      "batch_id": "20260904024500",
      "errors": [],
      "first_raw_sha256": "3ba6f9f1294d460828679289417d52a67621f4b0ca337bb4868eadbbfd43364e",
      "first_semantic_sha256": "c34c2b128eba06375bcacc03a9963ed1011e88f10ed245283ca1921c6c5a56c4",
      "hash_matches_acquisition": true,
      "matches_original_semantics": true,
      "second_raw_sha256": "3ba6f9f1294d460828679289417d52a67621f4b0ca337bb4868eadbbfd43364e",
      "second_semantic_sha256": "c34c2b128eba06375bcacc03a9963ed1011e88f10ed245283ca1921c6c5a56c4",
      "semantic_equal": true,
      "status": "passed"
    },
    {
      "batch_id": "20260904030000",
      "errors": [],
      "first_raw_sha256": "b86fda57bc75cfd1a0b81cd0078f633eb5051c9fda72f94c3bf7e84a7e28bff6",
      "first_semantic_sha256": "eec1de88f8b750f2d8e7710b8568959b9aad3360393e0d1f3d762d93ccb374c2",
      "hash_matches_acquisition": true,
      "matches_original_semantics": true,
      "second_raw_sha256": "b86fda57bc75cfd1a0b81cd0078f633eb5051c9fda72f94c3bf7e84a7e28bff6",
      "second_semantic_sha256": "eec1de88f8b750f2d8e7710b8568959b9aad3360393e0d1f3d762d93ccb374c2",
      "semantic_equal": true,
      "status": "passed"
    },
    {
      "batch_id": "20260904031500",
      "errors": [],
      "first_raw_sha256": "b57ca2302720fd70e427f98ada7ea87da7bc810318085b610a7026786b614820",
      "first_semantic_sha256": "8a08ee26830f488c651f0f8ca1d3c59c1019739145e23e60bdac23f2af7bec1e",
      "hash_matches_acquisition": true,
      "matches_original_semantics": true,
      "second_raw_sha256": "b57ca2302720fd70e427f98ada7ea87da7bc810318085b610a7026786b614820",
      "second_semantic_sha256": "8a08ee26830f488c651f0f8ca1d3c59c1019739145e23e60bdac23f2af7bec1e",
      "semantic_equal": true,
      "status": "passed"
    },
    {
      "batch_id": "20260904033000",
      "errors": [],
      "first_raw_sha256": "23d0a96eddd76da341fdf6f2fa07fbed6b420d40fec79c8e3bbfb5735d3ad7ad",
      "first_semantic_sha256": "62d260fd62b0e219283eaae5eb9324ec919cbfecdb569d34a48b499b53cad52b",
      "hash_matches_acquisition": true,
      "matches_original_semantics": true,
      "second_raw_sha256": "23d0a96eddd76da341fdf6f2fa07fbed6b420d40fec79c8e3bbfb5735d3ad7ad",
      "second_semantic_sha256": "62d260fd62b0e219283eaae5eb9324ec919cbfecdb569d34a48b499b53cad52b",
      "semantic_equal": true,
      "status": "passed"
    },
    {
      "batch_id": "20260904034500",
      "errors": [],
      "first_raw_sha256": "ea875ce1a401ffb71c03c350ecd9f35f30466e01276a355142cd4eff42231388",
      "first_semantic_sha256": "494084fa4a8bb37d385856999be73a80cbdb65e5559298ce3908b690e16fe681",
      "hash_matches_acquisition": true,
      "matches_original_semantics": true,
      "second_raw_sha256": "ea875ce1a401ffb71c03c350ecd9f35f30466e01276a355142cd4eff42231388",
      "second_semantic_sha256": "494084fa4a8bb37d385856999be73a80cbdb65e5559298ce3908b690e16fe681",
      "semantic_equal": true,
      "status": "passed"
    },
    {
      "batch_id": "20260904040000",
      "errors": [],
      "first_raw_sha256": "d46eb2dafa5243119876e5728512a6e1ba7a3463fd5ea45c0c617d71afcbeb9e",
      "first_semantic_sha256": "55383c0e1e63e627117228ec641b4002ac8eb6222d7b08ebee5a85b22677393e",
      "hash_matches_acquisition": true,
      "matches_original_semantics": true,
      "second_raw_sha256": "d46eb2dafa5243119876e5728512a6e1ba7a3463fd5ea45c0c617d71afcbeb9e",